{"alpha":0.0001,"classes":["aggressive_100","aggressive_25","aggressive_50","passive_50"],"coefs":[[[-1.8395824449704719,-1.2278314364479925,0.20484603769145646,-1.9127383028335805,2.8096584326378924,1.702204842128276,1.8813954345606683,1.2692825388997122],[2.019431056676365,5.83116761068771,-0.8589425820462958,-0.6157395996667786,1.9949417042322746,-2.9723750029153737,1.6950185542288778,4.814402895638628],[4.222502526643208,-0.35136918969106246,0.4365568846409694,6.026468870604046,-4.530519310582576,3.0963703283202415,-0.12086216517227544,0.00975266081263046],[0.6434777412962658,0.18277386196323767,1.315057005849461,8.149305429243134,-2.458526294687701,2.3933531814452227,1.3307485206484666,7.200309411726643],[5.985545111654203,3.2274368416638533,-0.8865757385705849,-4.945534184174536,0.6939306789350079,4.522463903351148,0.31717998672463893,-10.241546749932073],[4.920646706829985,9.273599239386984,1.5931217877586472,-9.753509285392001,1.111451446621044,7.216542581420495,4.174179133661312,-0.041266405525473955],[0.5807529825675283,5.13526710469737,1.6940411008995901,-4.492935948329137,-0.46395642247058877,2.3142111952315765,3.1379612594751007,7.093674701867615],[-2.8722489466449734,-1.7829466423928106,-0.2548283690052889,-1.4171787450571922,-1.9292528942384122,-0.971564992415873,0.30541210825436993,1.1791426517411066],[5.679252089103255,0.602245382171558,0.4049917110590564,5.741384373667065,2.1013160953140044,0.7015121014204612,1.8745236897590225,0.23562284663780536],[-4.895480144078472,-1.0663436817976735,-0.061092117232372144,-5.890396620225094,-1.8149433373496773,-0.7580862503439381,-1.8693011110254447,0.2581215927235812],[-6.27570540510701,-1.3252501863984703,-0.4130122430065491,-5.884863223239618,-2.0186133388743737,-0.9725616050503852,-0.8490459995827592,0.9440290152496169],[2.799575244435995,1.3278227513550502,-0.6542754346737207,1.22467542722582,1.658276436662837,0.13061555473581682,-0.8492326750389986,-0.8457850881746484],[-8.451485226193284,-9.501370685091501,-1.740327822292772,8.535314405428888,-1.8017542724508229,-8.740580906250933,-3.4542051872728643,5.6914105101263965]],[[-5.474308819975448,-1.6266919501760848,-4.013354323232867,12.92204921684117],[-6.584601129146083,-1.5272021112179475,-3.427938361307821,12.485065232758066],[-0.29696122149211257,0.016954832664118753,-0.194758805298989,1.1590230054523087],[6.242655794022135,-4.1788751294361495,1.5462792673752361,-3.700423446855348],[-3.478552068107022,2.1414157979171673,-0.10940429758843448,0.31616018789809597],[-5.9756962964219635,-2.3096697342672092,-5.084459174036732,13.159199131092677],[-2.396770918007112,-1.6409789848079335,-2.8121709760899742,5.3172499570314065],[6.314965331166391,-2.00805278997833,1.2279424393599454,-5.900900027143629]]],"feature_names":["midpoint_ticks","spread_ticks","same_side_best_lots","opposite_side_best_lots","same_side_queue_share","passive_fill_pressure","passive_fill_probability","elapsed_fraction","filled_fraction","remaining_fraction","progress_lag","time_remaining_fraction","prediction_probability"],"hidden_units":8,"intercepts":[[5.367655382957899,9.129517431635659,-0.6206078433283854,1.3113689145978773,-2.502833775364122,6.585201037128412,1.24600038215131,0.8474288232731452],[-7.964298113789281,7.040381619671443,9.863894842674183,-8.785302181881502]],"scaler_mean":[99.99823633156967,2.998236331569665,138.63668430335096,135.1058201058201,0.5034691973024817,0.5555555555555565,0.5178833056583275,0.3918283362727806,0.4912698412698413,0.5087301587301587,-0.09944150499706055,0.608171663727219,0.4647802150664014],"scaler_scale":[0.8154139364212525,0.9999984447356246,69.29080346182562,67.37498908971254,0.1906601084985996,0.29481109247603693,0.1349678140256252,0.28596034335943316,0.30358029865659336,0.30358029865659336,0.38187551137815595,0.28596034335943316,0.2023410334072241],"schema_version":"imitation-policy-artifact-v1"}
